{
  "schema_version": "1.0.0",
  "id": "mw.catalog",
  "kind": "domain_plugin",
  "version": "0.1.0",
  "host_api": "^1.0.0",
  "domain": "catalog",
  "entrypoint": "./plugins/catalog/index.js",
  "models": [
    "catalog.product",
    "catalog.offer"
  ],
  "requires": [
    "mw.foundation"
  ],
  "database": {
    "ownership": "exclusive_domain_owner",
    "logical_name": "catalog"
  },
  "extension_points": [
    "catalog.validators@1",
    "catalog.commands@1",
    "catalog.projectors@1",
    "catalog.ui@1"
  ],
  "capabilities": {
    "provides": [
      "domain.catalog.models@1",
      "domain.catalog.queries@1",
      "domain.catalog.commands@1"
    ],
    "requires": []
  }
}
